{
  "schemaVersion": "1.0.0",
  "manifestVersion": 1,
  "projectId": "snowbound-hotel",
  "storyVersion": 1,
  "productionVersion": 1,
  "bibleVersion": 1,
  "promptVersion": "v1",
  "workflowVersion": "production-dag-v1",
  "runtimeVersion": 1,
  "buildVersion": "1.1.0-dev",
  "generatedAt": "2026-08-30T05:00:00.000Z",
  "assets": [
    {
      "id": "runtime-data",
      "type": "RUNTIME_DATA",
      "uri": "runtime-package.json",
      "mimeType": "application/json",
      "sizeBytes": 13562,
      "sha256": "sha256:83c690216a8c33ad7e8e41df0d31b990688228780a50d582033d94b0d9d0936f",
      "status": "GENERATED",
      "dependencies": [],
      "source": "BUILT",
      "providerMetadata": {
        "provider": "filmgame-runtime-packager"
      },
      "provenance": {
        "source": "BUILT",
        "provider": "filmgame-runtime-packager",
        "modelLicense": "FIRST_PARTY",
        "referenceAssetIds": [],
        "referenceLicenseIds": [],
        "createdAt": "2026-08-30T05:00:00.000Z",
        "approval": "SYSTEM_VALIDATED",
        "commercialUseStatus": "APPROVED"
      },
      "license": {
        "commercialUseApproved": true,
        "commercialUseStatus": "APPROVED",
        "licenseId": "FIRST_PARTY"
      }
    },
    {
      "id": "video-scene-lobby",
      "type": "FINAL_SCENE",
      "uri": "missing://video-scene-lobby.mp4",
      "mimeType": "video/mp4",
      "sizeBytes": 0,
      "sha256": "sha256:e3b0c44298fc1c149afbf4c8996fb92427ae41e4649b934ca495991b7852b855",
      "status": "MISSING",
      "dependencies": [],
      "source": "GENERATED",
      "entityType": "SCENE",
      "entityId": "scene-lobby",
      "providerMetadata": {
        "provider": "unconfigured"
      },
      "provenance": {
        "source": "GENERATED",
        "provider": "unconfigured",
        "referenceAssetIds": [],
        "referenceLicenseIds": [],
        "createdAt": "2026-08-30T05:00:00.000Z",
        "approval": "UNREVIEWED",
        "commercialUseStatus": "UNKNOWN"
      },
      "license": {
        "commercialUseApproved": false,
        "commercialUseStatus": "UNKNOWN"
      }
    },
    {
      "id": "video-scene-archive",
      "type": "FINAL_SCENE",
      "uri": "missing://video-scene-archive.mp4",
      "mimeType": "video/mp4",
      "sizeBytes": 0,
      "sha256": "sha256:e3b0c44298fc1c149afbf4c8996fb92427ae41e4649b934ca495991b7852b855",
      "status": "MISSING",
      "dependencies": [],
      "source": "GENERATED",
      "entityType": "SCENE",
      "entityId": "scene-archive",
      "providerMetadata": {
        "provider": "unconfigured"
      },
      "provenance": {
        "source": "GENERATED",
        "provider": "unconfigured",
        "referenceAssetIds": [],
        "referenceLicenseIds": [],
        "createdAt": "2026-08-30T05:00:00.000Z",
        "approval": "UNREVIEWED",
        "commercialUseStatus": "UNKNOWN"
      },
      "license": {
        "commercialUseApproved": false,
        "commercialUseStatus": "UNKNOWN"
      }
    },
    {
      "id": "video-ending-truth",
      "type": "FINAL_SCENE",
      "uri": "missing://video-ending-truth.mp4",
      "mimeType": "video/mp4",
      "sizeBytes": 0,
      "sha256": "sha256:e3b0c44298fc1c149afbf4c8996fb92427ae41e4649b934ca495991b7852b855",
      "status": "MISSING",
      "dependencies": [],
      "source": "GENERATED",
      "entityType": "ENDING",
      "entityId": "ending-truth",
      "providerMetadata": {
        "provider": "unconfigured"
      },
      "provenance": {
        "source": "GENERATED",
        "provider": "unconfigured",
        "referenceAssetIds": [],
        "referenceLicenseIds": [],
        "createdAt": "2026-08-30T05:00:00.000Z",
        "approval": "UNREVIEWED",
        "commercialUseStatus": "UNKNOWN"
      },
      "license": {
        "commercialUseApproved": false,
        "commercialUseStatus": "UNKNOWN"
      }
    },
    {
      "id": "video-ending-justice",
      "type": "FINAL_SCENE",
      "uri": "missing://video-ending-justice.mp4",
      "mimeType": "video/mp4",
      "sizeBytes": 0,
      "sha256": "sha256:e3b0c44298fc1c149afbf4c8996fb92427ae41e4649b934ca495991b7852b855",
      "status": "MISSING",
      "dependencies": [],
      "source": "GENERATED",
      "entityType": "ENDING",
      "entityId": "ending-justice",
      "providerMetadata": {
        "provider": "unconfigured"
      },
      "provenance": {
        "source": "GENERATED",
        "provider": "unconfigured",
        "referenceAssetIds": [],
        "referenceLicenseIds": [],
        "createdAt": "2026-08-30T05:00:00.000Z",
        "approval": "UNREVIEWED",
        "commercialUseStatus": "UNKNOWN"
      },
      "license": {
        "commercialUseApproved": false,
        "commercialUseStatus": "UNKNOWN"
      }
    },
    {
      "id": "video-ending-mercy",
      "type": "FINAL_SCENE",
      "uri": "missing://video-ending-mercy.mp4",
      "mimeType": "video/mp4",
      "sizeBytes": 0,
      "sha256": "sha256:e3b0c44298fc1c149afbf4c8996fb92427ae41e4649b934ca495991b7852b855",
      "status": "MISSING",
      "dependencies": [],
      "source": "GENERATED",
      "entityType": "ENDING",
      "entityId": "ending-mercy",
      "providerMetadata": {
        "provider": "unconfigured"
      },
      "provenance": {
        "source": "GENERATED",
        "provider": "unconfigured",
        "referenceAssetIds": [],
        "referenceLicenseIds": [],
        "createdAt": "2026-08-30T05:00:00.000Z",
        "approval": "UNREVIEWED",
        "commercialUseStatus": "UNKNOWN"
      },
      "license": {
        "commercialUseApproved": false,
        "commercialUseStatus": "UNKNOWN"
      }
    },
    {
      "id": "video-ending-ashes",
      "type": "FINAL_SCENE",
      "uri": "missing://video-ending-ashes.mp4",
      "mimeType": "video/mp4",
      "sizeBytes": 0,
      "sha256": "sha256:e3b0c44298fc1c149afbf4c8996fb92427ae41e4649b934ca495991b7852b855",
      "status": "MISSING",
      "dependencies": [],
      "source": "GENERATED",
      "entityType": "ENDING",
      "entityId": "ending-ashes",
      "providerMetadata": {
        "provider": "unconfigured"
      },
      "provenance": {
        "source": "GENERATED",
        "provider": "unconfigured",
        "referenceAssetIds": [],
        "referenceLicenseIds": [],
        "createdAt": "2026-08-30T05:00:00.000Z",
        "approval": "UNREVIEWED",
        "commercialUseStatus": "UNKNOWN"
      },
      "license": {
        "commercialUseApproved": false,
        "commercialUseStatus": "UNKNOWN"
      }
    },
    {
      "id": "video-ending-identity",
      "type": "FINAL_SCENE",
      "uri": "missing://video-ending-identity.mp4",
      "mimeType": "video/mp4",
      "sizeBytes": 0,
      "sha256": "sha256:e3b0c44298fc1c149afbf4c8996fb92427ae41e4649b934ca495991b7852b855",
      "status": "MISSING",
      "dependencies": [],
      "source": "GENERATED",
      "entityType": "ENDING",
      "entityId": "ending-identity",
      "providerMetadata": {
        "provider": "unconfigured"
      },
      "provenance": {
        "source": "GENERATED",
        "provider": "unconfigured",
        "referenceAssetIds": [],
        "referenceLicenseIds": [],
        "createdAt": "2026-08-30T05:00:00.000Z",
        "approval": "UNREVIEWED",
        "commercialUseStatus": "UNKNOWN"
      },
      "license": {
        "commercialUseApproved": false,
        "commercialUseStatus": "UNKNOWN"
      }
    },
    {
      "id": "video-ending-revenge",
      "type": "FINAL_SCENE",
      "uri": "missing://video-ending-revenge.mp4",
      "mimeType": "video/mp4",
      "sizeBytes": 0,
      "sha256": "sha256:e3b0c44298fc1c149afbf4c8996fb92427ae41e4649b934ca495991b7852b855",
      "status": "MISSING",
      "dependencies": [],
      "source": "GENERATED",
      "entityType": "ENDING",
      "entityId": "ending-revenge",
      "providerMetadata": {
        "provider": "unconfigured"
      },
      "provenance": {
        "source": "GENERATED",
        "provider": "unconfigured",
        "referenceAssetIds": [],
        "referenceLicenseIds": [],
        "createdAt": "2026-08-30T05:00:00.000Z",
        "approval": "UNREVIEWED",
        "commercialUseStatus": "UNKNOWN"
      },
      "license": {
        "commercialUseApproved": false,
        "commercialUseStatus": "UNKNOWN"
      }
    }
  ],
  "runtimePackages": [
    {
      "id": "runtime-package-dev",
      "target": "UNREAL_WINDOWS",
      "version": "0.1.0-dev",
      "entryAssetId": "runtime-data",
      "assetIds": [
        "runtime-data",
        "video-scene-lobby",
        "video-scene-archive",
        "video-ending-truth",
        "video-ending-justice",
        "video-ending-mercy",
        "video-ending-ashes",
        "video-ending-identity",
        "video-ending-revenge"
      ],
      "sha256": "sha256:83c690216a8c33ad7e8e41df0d31b990688228780a50d582033d94b0d9d0936f",
      "status": "BUILDING"
    }
  ],
  "metadata": {
    "fixture": true,
    "publishable": false,
    "reason": "Media providers are not configured; scene video assets are explicitly MISSING."
  }
}
